ID: 10484
Title: Casting string to real is not compatible with MySQL
Description:
## Description
## Bug Report

Please answer these questions before submitting your issue. Thanks!

1. What did you do?
If possible, provide a recipe for reproducing the error.
```
create table t (a varchar(30));
insert into t values (2), ("");
select * from t where a=2;
show warnings;
delete from t where a=2;
```

2. What did you expect to see?
```
mysql> create table t (a varchar(30));
Query OK, 0 rows affected (0.05 sec)

mysql> insert into t values (2), ("");
Query OK, 2 rows affected (0.01 sec)
Records: 2  Duplicates: 0  Warnings: 0

mysql> select * from t where a=2;
+------+
| a    |
+------+
| 2    |
+------+
1 row in set (0.00 sec)

mysql> show warnings;
Empty set (0.00 sec)

mysql> delete from t where a=2;
Query OK, 1 row affected (0.05 sec)
```


3. What did you see instead?
```
mysql> create table t (a varchar(30));
Query OK, 0 rows affected (0.00 sec)

mysql> insert into t values (2), ("");
Query OK, 2 rows affected (0.01 sec)
Records: 2  Duplicates: 0  Warnings: 0

mysql> select * from t where a=2;
+------+
| a    |
+------+
| 2    |
+------+
1 row in set, 1 warning (0.00 sec)

mysql> show warnings;
+---------+------+----------------+
| Level   | Code | Message        |
+---------+------+----------------+
| Warning | 1265 | Data Truncated |
+---------+------+----------------+
1 row in set (0.00 sec)

mysql> delete from t where a=2;
ERROR 1265 (01000): Data Truncated
```


4. What version of TiDB are you using (`tidb-server -V` or run `select tidb_version();` on TiDB)?
```
mysql> select tidb_version();
+--------------------------------------------------------------------------------------------------------------------------------------------------------------------------------------------------------------------------------------------------------------------------------------------------------------------------------------+
| tidb_version()                                                                                                                                                                                                                                                                                                                       |
+--------------------------------------------------------------------------------------------------------------------------------------------------------------------------------------------------------------------------------------------------------------------------------------------------------------------------------------+
| Release Version: v3.0.0-rc.1-58-gfc2768c02
Git Commit Hash: fc2768c0297be90925cea1b83b3bb0b7997ec00b
Git Branch: fix-10181
UTC Build Time: 2019-05-15 08:31:51
GoVersion: go version go1.12 darwin/amd64
Race Enabled: false
TiKV Min Version: 2.1.0-alpha.1-ff3dd160846b7d1aed9079c389fc188f7f5ea13e
Check Table Before Drop: false |
+--------------------------------------------------------------------------------------------------------------------------------------------------------------------------------------------------------------------------------------------------------------------------------------------------------------------------------------+
1 row in set (0.00 sec)
```





## SIG slack channel
[#sig-exec](https://tidbcommunity.slack.com/archives/CMRD79DRR)

## Score
- 300

## Mentor
 * @XuHuaiyu
