ID: 11059
Title: A critical bug was introduced during a tiny refactor in PR/11018
Description:
## Bug Report

Please answer these questions before submitting your issue. Thanks!

This line introduces the bug:
https://github.com/pingcap/tidb/pull/11018/files#diff-84f3439ff795a2ffd72177b335c225d3R144

The if-else branch is reversed

1. What did you do?
If possible, provide a recipe for reproducing the error.

```
mysql> show create table t;
+-------+-----------------------------------------------------------------------------------------------------------------------------------------------------------------------------------------------------------------+
| Table | Create Table                                                                                                                                                                                                    |
+-------+-----------------------------------------------------------------------------------------------------------------------------------------------------------------------------------------------------------------+
| t     | CREATE TABLE `t` (
  `pk` int(11) NOT NULL,
  `uk` int(11) DEFAULT NULL,
  `v` int(11) DEFAULT NULL,
  PRIMARY KEY (`pk`),
  UNIQUE KEY `uk` (`uk`)
) ENGINE=InnoDB DEFAULT CHARSET=utf8mb4 COLLATE=utf8mb4_bin |
+-------+-----------------------------------------------------------------------------------------------------------------------------------------------------------------------------------------------------------------+
1 row in set (0.00 sec)


mysql> insert into t values (2,11,215);
Query OK, 1 row affected (0.00 sec)

mysql> insert into t values (3, 7, 2111);
Query OK, 1 row affected (0.00 sec)

mysql> update t set pk = 2 where uk = 7;
Query OK, 1 row affected (0.01 sec)
Rows matched: 1  Changed: 1  Warnings: 0

mysql> admin check table t;
ERROR 8003 (HY000): t err:[admin:1]index:&admin.RecordData{Handle:2, Values:[]types.Datum{types.Datum{k:0x1, collation:0x0, decimal:0x0, length:0x0, i:11, b:[]uint8(nil), x:interface {}(nil)}}} != record:&admin.RecordData{Handle:2, Values:[]types.Datum{types.Datum{k:0x1, collation:0x0, decimal:0x0, length:0x0, i:7, b:[]uint8(nil), x:interface {}(nil)}}}

mysql> insert into t values (3, 11, 211);
ERROR 1062 (23000): Duplicate entry '11' for key 'uk'

mysql> select * from t where uk = 11;
+----+------+------+
| pk | uk   | v    |
+----+------+------+
|  2 |    7 | 2111 |
+----+------+------+
1 row in set (0.00 sec)
```

2. What did you expect to see?

`admin check table` should not return error

3. What did you see instead?

Obviously, the data was broken

4. What version of TiDB are you using (`tidb-server -V` or run `select tidb_version();` on TiDB)?

git hash 755875aacb5ad8d6a2346246d583d9b2861401a1