ID: 16267
Title: json_array get wrong answer in where and delete statement
Description:
## Bug Report
guess it was an error when converting int64 to float64
### 1. What did you do?
```
mysql root@localhost:test> create table tx2 (col json);
Query OK, 0 rows affected
Time: 0.007s
mysql root@localhost:test> insert into tx2 values (json_array(922337203685477581));
Query OK, 1 row affected
Time: 0.004s
mysql root@localhost:test> insert into tx2 values (json_array(922337203685477580));
Query OK, 1 row affected
Time: 0.001s
mysql root@localhost:test> select * from tx2
+----------------------+
| col                  |
+----------------------+
| [922337203685477581] |
| [922337203685477580] |
+----------------------+
2 rows in set
Time: 0.015s
```
### 2. What did you expect to see?
see in mysql8.0
```
mysql root@mysql.db.svc.cluster.local:test> select * from tx2 where col=json_array(922337203685477580)
+----------------------+
| col                  |
+----------------------+
| [922337203685477580] |
+----------------------+
1 row in set
Time: 0.079s
mysql root@mysql.db.svc.cluster.local:test> delete from tx2 where col=json_array(922337203685477581)
You're about to run a destructive command.
Do you want to proceed? (y/n): y
Your call!
Query OK, 1 row affected
Time: 0.042s
mysql root@mysql.db.svc.cluster.local:test> select * from tx2
+----------------------+
| col                  |
+----------------------+
| [922337203685477580] |
+----------------------+
1 row in set
Time: 0.054s
```
### 3. What did you see instead?
```
mysql root@localhost:test> select * from tx2 where col=json_array(922337203685477580)
+----------------------+
| col                  |
+----------------------+
| [922337203685477581] |
| [922337203685477580] |
+----------------------+
2 rows in set
Time: 0.016s
mysql root@localhost:test> delete from tx2 where col=json_array(922337203685477581)
You're about to run a destructive command.
Do you want to proceed? (y/n): y
Your call!
Query OK, 2 rows affected
Time: 0.003s
mysql root@localhost:test> select * from tx2
+-----+
| col |
+-----+
0 rows in set
Time: 0.013s
```
### 4. What version of TiDB are you using? (`tidb-server -V` or run `select tidb_version();` on TiDB)
tidb v4.0