ID: 20741
Title: The default value of a newly added enum column is set improperly
Description:
## Bug Report

Please answer these questions before submitting your issue. Thanks!

### 1. Minimal reproduce step (Required)

<!-- a step by step guide for reproducing the bug. -->
```sql
drop table if exists t;
create table t (id int primary key, c int);
insert into t (id, c) values (1, 1), (2, 2);

alter table t add column cc enum('a','b','c','d','e') not null;
update t set c = 2 where id = 1;
select * from t;
select * from t where cc = 0;
select * from t where cc = 1;
```

### 2. What did you expect to see? (Required)

```
mysql> update t set c = 2 where id = 1;
Query OK, 1 row affected (0.06 sec)
Rows matched: 1  Changed: 1  Warnings: 0

mysql> select * from t;
+----+------+----+
| id | c    | cc |
+----+------+----+
|  1 |    2 | a  |
|  2 |    2 | a  |
+----+------+----+
2 rows in set (0.05 sec)

mysql> select * from t where cc = 0;
Empty set (0.05 sec)

mysql> select * from t where cc = 1;
+----+------+----+
| id | c    | cc |
+----+------+----+
|  1 |    2 | a  |
|  2 |    2 | a  |
+----+------+----+
2 rows in set (0.06 sec)

```

### 3. What did you see instead (Required)

```
mysql> update t set c = 2 where id = 1;
ERROR 1265 (01000): Data truncated for column '%s' at row %d

mysql> select * from t;
+----+------+----+
| id | c    | cc |
+----+------+----+
|  1 |    1 |    |
|  2 |    2 |    |
+----+------+----+
2 rows in set, 1 warning (0.06 sec)

mysql> select * from t where cc = 0;
+----+------+----+
| id | c    | cc |
+----+------+----+
|  1 |    1 |    |
|  2 |    2 |    |
+----+------+----+
2 rows in set, 1 warning (0.06 sec)

mysql> select * from t where cc = 1;
Empty set, 1 warning (0.06 sec)

```

### 4. What is your TiDB version? (Required)

<!-- Paste the output of SELECT tidb_version() -->
master
release-4.0
## Score

- 600

## Mentor

- @wjhuang2016 