ID: 20881
Title: clustered index + new collation + transaction, `delete from t` doesn't delete all the values.
Description:
## Bug Report

Please answer these questions before submitting your issue. Thanks!

### 1. Minimal reproduce step (Required)

<!-- a step by step guide for reproducing the bug. -->
``` sql
mysql> show create table t;
+-------+--------------------------------------------------------------------------------------------------------------------------------------------------------------------------------------------------------------------------------------------------------------------------------------------------------------+
| Table | Create Table                                                                                                                                                                                                                                                                                                 |
+-------+--------------------------------------------------------------------------------------------------------------------------------------------------------------------------------------------------------------------------------------------------------------------------------------------------------------+
| t     | CREATE TABLE `t` (
  `a` char(10) COLLATE utf8mb4_unicode_ci NOT NULL,
  `b` char(21) COLLATE utf8mb4_general_ci NOT NULL,
  `c` int(11) NOT NULL,
  PRIMARY KEY (`a`,`b`,`c`),
  KEY `idx` (`a`),
  KEY `idx1` (`a`,`b`),
  KEY `idx2` (`a`(1))
) ENGINE=InnoDB DEFAULT CHARSET=utf8mb4 COLLATE=utf8mb4_bin |
+-------+--------------------------------------------------------------------------------------------------------------------------------------------------------------------------------------------------------------------------------------------------------------------------------------------------------------+
1 row in set (0.00 sec)
mysql> select * from t;
+----+----+---+
| a  | b  | c |
+----+----+---+
| a5 | b5 | 3 |
+----+----+---+
1 row in set (0.00 sec)

mysql> begin;
Query OK, 0 rows affected (0.00 sec)

mysql> insert into t values("a6", "b6", 3);
Query OK, 1 row affected (0.00 sec)

mysql> delete from t;
Query OK, 2 rows affected (0.00 sec)

mysql> select * from t;
+------+------+---+
| a    | b    | c |
+------+------+---+
| 3/ |  B 6 | 3 |
+------+------+---+
1 row in set (0.01 sec)

mysql> commit;
Query OK, 0 rows affected (0.00 sec)

mysql> select * from t;
+----+----+---+
| a  | b  | c |
+----+----+---+
| a6 | b6 | 3 |
+----+----+---+
1 row in set (0.00 sec)
```


### 2. What did you expect to see? (Required)
After `delete from t;`, all rows are removed.
### 3. What did you see instead (Required)
One row left.
### 4. What is your TiDB version? (Required)

<!-- Paste the output of SELECT tidb_version() -->

master.