ID: 20985
Title: lock tables drainerxxx.checkpoint statement does not take effect
Description:
## Bug Report

Please answer these questions before submitting your issue. Thanks!

### 1. Minimal reproduce step (Required)
1. offline drainer, consistent param turn to "true" in drainer86_3.checkpoint
2. locked drainer86_3.checkpoint
3. online drainer, check consistent param in drainer86_3.checkpoint, (should not change)
4. manually change consistent to "true"
5. check the consistent value

```MySQL [(none)]> select * from drainer86_3.checkpoint;
+---------------------+--------------------------------------------------------------------------------------------------------------------------------+
| clusterID           | checkPoint                                                                                                                     |
+---------------------+--------------------------------------------------------------------------------------------------------------------------------+
| 6891584860117381117 | {"consistent":true,"commitTS":420760883729268739,"ts-map":{"primary-ts":420729425184686081,"secondary-ts":420729425285349386}} |
+---------------------+--------------------------------------------------------------------------------------------------------------------------------+
1 row in set (0.00 sec)

MySQL [(none)]> lock tables drainer86_3.checkpoint write;
Query OK, 0 rows affected (0.22 sec)

MySQL [(none)]> select * from drainer86_3.checkpoint;
+---------------------+---------------------------------------------------------------------------------------------------------------------------------+
| clusterID           | checkPoint                                                                                                                      |
+---------------------+---------------------------------------------------------------------------------------------------------------------------------+
| 6891584860117381117 | {"consistent":false,"commitTS":420760966199771137,"ts-map":{"primary-ts":420729425184686081,"secondary-ts":420729425285349386}} |
+---------------------+---------------------------------------------------------------------------------------------------------------------------------+
1 row in set (0.00 sec)

MySQL [(none)]>```
MySQL [(none)]> update drainer86_3.checkpoint set checkPoint='{"consistent":true,"commitTS":420760883729268739,"ts-map":{"primary-ts":420729425184686081,"secondary-ts":420729425285349386}}';
Query OK, 1 row affected (0.02 sec)
Rows matched: 1  Changed: 1  Warnings: 0

MySQL [(none)]> select * from drainer86_3.checkpoint;
+---------------------+---------------------------------------------------------------------------------------------------------------------------------+
| clusterID           | checkPoint                                                                                                                      |
+---------------------+---------------------------------------------------------------------------------------------------------------------------------+
| 6891584860117381117 | {"consistent":false,"commitTS":420761272593678338,"ts-map":{"primary-ts":420729425184686081,"secondary-ts":420729425285349386}} |
+---------------------+---------------------------------------------------------------------------------------------------------------------------------+
1 row in set (0.00 sec)


### 2. What did you expect to see? (Required)
in step 3, expect consistent value should be still true
in step 5, expect consistent value should be true

### 3. What did you see instead (Required)
1. in step 3, the value changed to false
2. in step 5, the value changed still false
lock tables statement seems not in effect
if the table can't be locked, it should responsed fail when executed the lock tables statement.

### 4. What is your TiDB version? (Required)
<!-- Paste the output of SELECT tidb_version() -->
| Release Version: v4.0.8
Edition: Community
Git Commit Hash: 66ac9fc31f1733e5eb8d11891ec1b38f9c422817
Git Branch: heads/refs/tags/v4.0.8
UTC Build Time: 2020-10-30 08:21:16
GoVersion: go1.13
Race Enabled: false
TiKV Min Version: v3.0.0-60965b006877ca7234adaced7890d7b029ed1306
Check Table Before Drop: false |
