ID: 25211
Title: UPDATE result not compatible with MySQL
Description:
## Bug Report

Please answer these questions before submitting your issue. Thanks!

### 1. Minimal reproduce step (Required)

**TiDB version: v5.0.0-nightly-20210605**
```
mysql> create table t (a int);
Query OK, 0 rows affected (0.06 sec)

mysql> insert into t value (1);
Query OK, 1 row affected (0.01 sec)

mysql> select * from t;
+------+
| a    |
+------+
|    1 |
+------+
1 row in set (0.00 sec)

mysql> update t set a = 2, a = a;
Query OK, 0 rows affected (0.00 sec)
Rows matched: 1  Changed: 0  Warnings: 0

mysql> select * from t;
+------+
| a    |
+------+
|    1 |
+------+
1 row in set (0.00 sec)
```

**MySQL version: 8.0.25**
```
mysql> create table t (a int);
Query OK, 0 rows affected (0.01 sec)

mysql> insert into t value (1);
Query OK, 1 row affected (0.00 sec)

mysql> select * from t;
+------+
| a    |
+------+
|    1 |
+------+
1 row in set (0.00 sec)

mysql> update t set a = 2, a = a;
Query OK, 1 row affected (0.00 sec)
Rows matched: 1  Changed: 1  Warnings: 0

mysql> select * from t;
+------+
| a    |
+------+
|    2 |
+------+
1 row in set (0.00 sec)
```
### 2. What did you expect to see? (Required)

### 3. What did you see instead (Required)

### 4. What is your TiDB version? (Required)

<!-- Paste the output of SELECT tidb_version() -->

