ID: 29524
Title: The insert generates a 0000-00-00 date for 0 or NULL, which is deleted in MySQL but not tidb.
Description:
## Bug Report

Please answer these questions before submitting your issue. Thanks!

### 1. Minimal reproduce step (Required)

<!-- a step by step guide for reproducing the bug. -->
```sql
drop table t1;
create table t1(a date not null);
insert ignore into t1 values (0);
select * from t1 where a is null;
delete from t1 where a is null;
select count(*) from t1;
```
### 2. What did you expect to see? (Required)
```sql
mysql> drop table t1;
Query OK, 0 rows affected (0.02 sec)

mysql> create table t1(a date not null);
Query OK, 0 rows affected (0.01 sec)

mysql> insert ignore into t1 values (0);
Query OK, 1 row affected (0.00 sec)

mysql> select * from t1 where a is null;
+------------+
| a          |
+------------+
| 0000-00-00 |
+------------+
1 row in set (0.00 sec)

mysql> delete from t1 where a is null;
Query OK, 1 row affected (0.00 sec)

mysql> select count(*) from t1;
+----------+
| count(*) |
+----------+
|        0 |
+----------+
1 row in set (0.00 sec)
```

### 3. What did you see instead (Required)
```sql
mysql> drop table t1;
Query OK, 0 rows affected (0.22 sec)

mysql> create table t1(a date not null);
Query OK, 0 rows affected (0.13 sec)

mysql> insert ignore into t1 values (0);
Query OK, 1 row affected (0.00 sec)

mysql> select * from t1 where a is null;
Empty set (0.00 sec)

mysql> delete from t1 where a is null;
Query OK, 0 rows affected (0.00 sec)

mysql> select count(*) from t1;
+----------+
| count(*) |
+----------+
|        1 |
+----------+
1 row in set (0.00 sec)
```
### 4. What is your TiDB version? (Required)
```sql
| Release Version: v5.2.2
Edition: Community
Git Commit Hash: da1c21fd45a4ea5900ac16d2f4a248143f378d18
Git Branch: heads/refs/tags/v5.2.2
UTC Build Time: 2021-10-20 06:03:45
GoVersion: go1.16.5
Race Enabled: false
TiKV Min Version: v3.0.0-60965b006877ca7234adaced7890d7b029ed1306
Check Table Before Drop: false |

```
<!-- Paste the output of SELECT tidb_version() -->

