ID: 30596
Title: Year with some decimal values like(1998.9 or 1999.1) is not handled in TIDB
Description:
## Bug Report

Please answer these questions before submitting your issue. Thanks!

### 1. Minimal reproduce step (Required)

<!-- a step by step guide for reproducing the bug. -->
```sql
CREATE TABLE t4(yyyy YEAR, c4 CHAR(4));
INSERT INTO t4 (c4) VALUES (NULL),(1970),(1999),(2000),(2001),(2069);
UPDATE t4 SET yyyy = c4;
SELECT * FROM t4;
SELECT * FROM t4 WHERE yyyy = 1999.1;
SELECT * FROM t4 WHERE yyyy = 1998.9;
DROP TABLE t4;
```
### 2. What did you expect to see? (Required)
```sql
mysql> CREATE TABLE t4(yyyy YEAR, c4 CHAR(4));
Query OK, 0 rows affected (0.01 sec)

mysql> INSERT INTO t4 (c4) VALUES (NULL),(1970),(1999),(2000),(2001),(2069);
Query OK, 6 rows affected (0.00 sec)
Records: 6  Duplicates: 0  Warnings: 0

mysql> UPDATE t4 SET yyyy = c4;
Query OK, 5 rows affected (0.00 sec)
Rows matched: 6  Changed: 5  Warnings: 0

mysql> SELECT * FROM t4;
+------+------+
| yyyy | c4   |
+------+------+
| NULL | NULL |
| 1970 | 1970 |
| 1999 | 1999 |
| 2000 | 2000 |
| 2001 | 2001 |
| 2069 | 2069 |
+------+------+
6 rows in set (0.00 sec)

mysql> SELECT * FROM t4 WHERE yyyy = 1999.1;
+------+------+
| yyyy | c4   |
+------+------+
| 1999 | 1999 |
+------+------+
1 row in set (0.00 sec)

mysql> SELECT * FROM t4 WHERE yyyy = 1998.9;
+------+------+
| yyyy | c4   |
+------+------+
| 1999 | 1999 |
+------+------+
1 row in set (0.00 sec)

```
### 3. What did you see instead (Required)
```sql
mysql> CREATE TABLE t4(yyyy YEAR, c4 CHAR(4));
Query OK, 0 rows affected (0.00 sec)

mysql> INSERT INTO t4 (c4) VALUES (NULL),(1970),(1999),(2000),(2001),(2069);
Query OK, 6 rows affected (0.00 sec)
Records: 6  Duplicates: 0  Warnings: 0

mysql> UPDATE t4 SET yyyy = c4;
Query OK, 5 rows affected (0.00 sec)
Rows matched: 6  Changed: 5  Warnings: 0

mysql> SELECT * FROM t4;
+------+------+
| yyyy | c4   |
+------+------+
| NULL | NULL |
| 1970 | 1970 |
| 1999 | 1999 |
| 2000 | 2000 |
| 2001 | 2001 |
| 2069 | 2069 |
+------+------+
6 rows in set (0.00 sec)

mysql> SELECT * FROM t4 WHERE yyyy = 1999.1;
Empty set (0.01 sec)

mysql> SELECT * FROM t4 WHERE yyyy = 1998.9;
Empty set (0.00 sec)

```
### 4. What is your TiDB version? (Required)

<!-- Paste the output of SELECT tidb_version() -->
```sql
| Release Version: v5.4.0-alpha-184-g51f53f337-dirty
Edition: Community
Git Commit Hash: 51f53f3376bd548b302f654d6c11096f89119145
Git Branch: master
UTC Build Time: 2021-11-23 02:51:51
GoVersion: go1.16.9
Race Enabled: false
TiKV Min Version: v3.0.0-60965b006877ca7234adaced7890d7b029ed1306
Check Table Before Drop: false |
```
