ID: 35141
Title: INDEX_LENGTH is different in INFORMATION_SCHEMA.Tables in Mysql and TIDB
Description:
## Bug Report

Please answer these questions before submitting your issue. Thanks!

### 1. Minimal reproduce step (Required)

<!-- a step by step guide for reproducing the bug. -->
```sql
 CREATE TABLE t1(val INT, KEY USING BTREE(val)) ENGINE=memory;
 INSERT INTO t1 VALUES(0);
SELECT INDEX_LENGTH FROM INFORMATION_SCHEMA.TABLES WHERE TABLE_SCHEMA=DATABASE() AND TABLE_NAME='t1';
 UPDATE t1 SET val=1;
 SELECT INDEX_LENGTH FROM INFORMATION_SCHEMA.TABLES WHERE TABLE_SCHEMA=DATABASE() AND TABLE_NAME='t1';
DROP TABLE t1;
```
### 2. What did you expect to see? (Required)
```sql
mysql>  CREATE TABLE t1(val INT, KEY USING BTREE(val)) ENGINE=memory;
Query OK, 0 rows affected (0.00 sec)

mysql>  INSERT INTO t1 VALUES(0);
Query OK, 1 row affected (0.00 sec)

mysql> SELECT INDEX_LENGTH FROM INFORMATION_SCHEMA.TABLES WHERE TABLE_SCHEMA=DATABASE() AND TABLE_NAME='t1';
+--------------+
| INDEX_LENGTH |
+--------------+
|           37 |
+--------------+
1 row in set (0.00 sec)

mysql>  UPDATE t1 SET val=1;
Query OK, 1 row affected (0.00 sec)
Rows matched: 1  Changed: 1  Warnings: 0

mysql>  SELECT INDEX_LENGTH FROM INFORMATION_SCHEMA.TABLES WHERE TABLE_SCHEMA=DATABASE() AND TABLE_NAME='t1';
+--------------+
| INDEX_LENGTH |
+--------------+
|           37 |
+--------------+
1 row in set (0.00 sec)

mysql> DROP TABLE t1;
Query OK, 0 rows affected (0.00 sec)

### 3. What did you see instead (Required)
```sql
mysql>  CREATE TABLE t1(val INT, KEY USING BTREE(val)) ENGINE=memory;
Query OK, 0 rows affected (0.00 sec)

mysql>  INSERT INTO t1 VALUES(0);
Query OK, 1 row affected (0.01 sec)

mysql> SELECT INDEX_LENGTH FROM INFORMATION_SCHEMA.TABLES WHERE TABLE_SCHEMA=DATABASE() AND TABLE_NAME='t1';
+--------------+
| INDEX_LENGTH |
+--------------+
|            0 |
+--------------+
1 row in set (0.00 sec)

mysql>  UPDATE t1 SET val=1;
Query OK, 1 row affected (0.00 sec)
Rows matched: 1  Changed: 1  Warnings: 0

mysql>  SELECT INDEX_LENGTH FROM INFORMATION_SCHEMA.TABLES WHERE TABLE_SCHEMA=DATABASE() AND TABLE_NAME='t1';
+--------------+
| INDEX_LENGTH |
+--------------+
|            0 |
+--------------+
1 row in set (0.01 sec)

mysql> DROP TABLE t1;
Query OK, 0 rows affected (0.01 sec)

```
### 4. What is your TiDB version? (Required)

<!-- Paste the output of SELECT tidb_version() -->

```sql
| Release Version: v6.1.0-alpha-480-g9f7813ca6
Edition: Community
Git Commit Hash: 9f7813ca6009fce061e92ae38a0b45cbfbc200f4
Git Branch: master
UTC Build Time: 2022-05-19 20:32:03
GoVersion: go1.18
Race Enabled: false
TiKV Min Version: v3.0.0-60965b006877ca7234adaced7890d7b029ed1306
Check Table Before Drop: false |
```