ID: 46881
Title: REMOVE PARTITIONING does not work with non-clustered tables
Description:
## Bug Report

Please answer these questions before submitting your issue. Thanks!

### 1. Minimal reproduce step (Required)

<!-- a step by step guide for reproducing the bug. -->
```mysql
create table t (a int primary key nonclustered) partition by hash (a) partitions 3;
insert into t values (1);
insert into t values (2);
select _tidb_rowid, a from t;
delete from t where a = 1;
select _tidb_rowid, a from t;
alter table t remove partitioning;
select _tidb_rowid, a from t;
insert into t values (1);
insert into t values (3);
```

### 2. What did you expect to see? (Required)
Success

### 3. What did you see instead (Required)
Duplicate key (_tidb_rowid was not carried over to the new table id).
```mysql
tidb> create table t (a int primary key nonclustered) partition by hash (a) partitions 3;
Query OK, 0 rows affected (0.13 sec)

tidb> insert into t values (1);
Query OK, 1 row affected (0.02 sec)

tidb> insert into t values (2);
Query OK, 1 row affected (0.01 sec)

tidb> select _tidb_rowid, a from t;
+-------------+---+
| _tidb_rowid | a |
+-------------+---+
|           1 | 1 |
|           2 | 2 |
+-------------+---+
2 rows in set, 1 warning (0.00 sec)

tidb> delete from t where a = 1;
Query OK, 1 row affected (0.01 sec)

tidb> select _tidb_rowid, a from t;
+-------------+---+
| _tidb_rowid | a |
+-------------+---+
|           2 | 2 |
+-------------+---+
1 row in set, 1 warning (0.00 sec)

tidb> alter table t remove partitioning;
Query OK, 0 rows affected (1.03 sec)

tidb> select _tidb_rowid, a from t;
+-------------+---+
| _tidb_rowid | a |
+-------------+---+
|           2 | 2 |
+-------------+---+
1 row in set (0.00 sec)

tidb> insert into t values (1);
Query OK, 1 row affected (0.01 sec)

tidb> insert into t values (3);
ERROR 1062 (23000): Duplicate entry '2' for key 't.PRIMARY'
```

### 4. What is your TiDB version? (Required)

<!-- Paste the output of SELECT tidb_version() -->
```
tidb_version(): Release Version: v7.4.0-alpha
Edition: Community
Git Commit Hash: 789d6d0b975522b098320ac818b3c028c75cffcf
Git Branch: heads/refs/tags/v7.4.0-alpha
UTC Build Time: 2023-09-11 14:38:23
GoVersion: go1.21.1
Race Enabled: false
Check Table Before Drop: false
Store: tikv
```

