ID: 4810
Title: maxint insert bug.
Description:
TiDB:

```
mysql> create table test1(id bigint, PRIMARY KEY (id));
Query OK, 0 rows affected (0.08 sec)

mysql> insert into test1 values(9223372036854775807);
Query OK, 1 row affected (0.00 sec)

mysql> select * from test1 where id = 9223372036854775807;
Empty set (0.01 sec)

mysql> select * from test1;
Empty set (0.00 sec)

mysql> insert into test1 values(9223372036854775807);
ERROR 1062 (23000): Duplicate entry '9223372036854775807' for key 'PRIMARY'

mysql> insert into test1 values(9223372036854775806);
Query OK, 1 row affected (0.00 sec)

mysql> select * from test1;
+---------------------+
| id                  |
+---------------------+
| 9223372036854775806 |
+---------------------+
1 row in set (0.00 sec)

mysql> delete from test1 where id = 9223372036854775807;
Query OK, 0 rows affected (0.00 sec)

mysql> select @@sql_mode;
+--------------------------------------------+
| @@sql_mode                                 |
+--------------------------------------------+
| STRICT_TRANS_TABLES,NO_ENGINE_SUBSTITUTION |
+--------------------------------------------+
1 row in set (0.00 sec)
```



What version of TiDB are you using (`tidb-server -V`)?

```
mysql> select tidb_version();
+-----------------------------------------------------------------------------------------------------------------------------------------+
| tidb_version()                                                                                                                          |
+-----------------------------------------------------------------------------------------------------------------------------------------+
| Release Version: 1.0.0
Git Commit Hash: 8643b2b428727b7652d8c67e42bc8cd7a60cb6d9
Git Branch: master
UTC Build Time: 2017-10-18 10:25:08 |
+-----------------------------------------------------------------------------------------------------------------------------------------+
1 row in set (0.00 sec)
```
