ID: 5132
Title: Update report unreasonable `Duplicate` error 
Description:
TiDB:

```
mysql> CREATE TABLE `tt1` (
  `a` int(11) NOT NULL,
  `b` varchar(32) DEFAULT NULL,
  `c` varchar(32) DEFAULT NULL,
  PRIMARY KEY (`a`),
  UNIQUE KEY `b_idx` (`b`)
) ENGINE=InnoDB DEFAULT CHARSET=utf8 COLLATE=utf8_bin;
Query OK, 0 rows affected (0.00 sec)

mysql> insert into tt1 values(1, 'a', 'a');
Query OK, 1 row affected (0.00 sec)

mysql> insert into tt1 values(2, 'd', 'b');
Query OK, 1 row affected (0.00 sec)

mysql> select * from tt1;
+---+------+------+
| a | b    | c    |
+---+------+------+
| 1 | a    | a    |
| 2 | d    | b    |
+---+------+------+
2 rows in set (0.00 sec)

mysql> update tt1 set a=5 where c='b';
ERROR 1062 (23000): Duplicate entry 'd' for key 'b_idx'

mysql> update tt1 set a=5 where c='a';
ERROR 1062 (23000): Duplicate entry 'a' for key 'b_idx'
```



4. What version of TiDB are you using (`tidb-server -V`)?

```
mysql> select tidb_version();
+--------------------------------------------------------------------------------------------------------------------------------------------------------------+
| tidb_version()                                                                                                                                               |
+--------------------------------------------------------------------------------------------------------------------------------------------------------------+
| Release Version: v1.1.0-alpha-106-g81652dbe
Git Commit Hash: 81652dbeefaa25a5116e19bc948c8ca268dd7a4d
Git Branch: master
UTC Build Time: 2017-11-17 04:46:48 |
+--------------------------------------------------------------------------------------------------------------------------------------------------------------+
1 row in set (0.00 sec)
```