ID: 5172
Title: index and record data may be inconsistency with onUpdateNow column
Description:
It seems index include column with HasOnUpdateNowFlag may be inconsistency with record data.

## What did you do?

I run the following sql on current version of tidb

```
mysql> CREATE TABLE test (
    ->   id int not null primary key AUTO_INCREMENT,
    ->   name CHAR(30) NOT NULL,
    ->   ts TIMESTAMP DEFAULT CURRENT_TIMESTAMP ON UPDATE CURRENT_TIMESTAMP,
    ->   tm int,
    ->   index(ts,tm)
    -> )ENGINE=InnoDB AUTO_INCREMENT=2 DEFAULT CHARSET=utf8;
Query OK, 0 rows affected (0.12 sec)

mysql> insert into test set name="shirly",tm=1;                                                                    
Query OK, 1 row affected (0.01 sec)

mysql> select * from test;
+----+--------+---------------------+------+
| id | name   | ts                  | tm   |
+----+--------+---------------------+------+
|  2 | shirly | 2017-11-21 16:38:26 |    1 |
+----+--------+---------------------+------+
1 row in set (0.00 sec)

mysql> update test set name="andremouche" where id=2;
Query OK, 1 row affected (0.01 sec)

mysql> select * from test;
+----+-------------+---------------------+------+
| id | name        | ts                  | tm   |
+----+-------------+---------------------+------+
|  2 | andremouche | 2017-11-21 16:38:53 |    1 |
+----+-------------+---------------------+------+
1 row in set (0.00 sec)

mysql> select ts from test use index(ts);
+---------------------+
| ts                  |
+---------------------+
| 2017-11-21 16:38:26 |
+---------------------+
1 row in set (0.00 sec)
```

##  What did you expect to see?
 I expect to see `2017-11-21 16:38:53` with the last query

## What did you see instead?

```
2017-11-21 16:38:26
```


## What version of TiDB are you using (`tidb-server -V`)?

```
Release Version: v1.0.2-11-gedcb9e9
Git Commit Hash: edcb9e9961d6396daa6bb4a728beedee0542ee28
Git Commit Branch: release-1.0
```

It seems you should set ```modified[i]=true ``` after https://github.com/pingcap/tidb/blob/master/executor/write.go#L122?