ID: 7422
Title: Updating rows by auto_increment id cause id increasing dramatically 
Description:
Please answer these questions before submitting your issue. Thanks!

1. What did you do?
If possible, provide a recipe for reproducing the error.
- connect to one tidb-server, and do:

```
mysql> create table t1(id bigint auto_increment primary key, b int);
Query OK, 0 rows affected (1.12 sec)

mysql> insert into t1(b) values(1);
Query OK, 1 row affected (0.19 sec)

mysql> select * from t1;
+----+------+
| id | b    |
+----+------+
|  1 |    1 |
+----+------+
1 row in set (0.00 sec)

```

- then checkout to another tidb-server:

```
mysql> select * from t1;
+----+------+
| id | b    |
+----+------+
|  1 |    1 |
+----+------+
1 row in set (0.14 sec)

mysql> insert into t1(b) values(1);
Query OK, 1 row affected (0.05 sec)

mysql> select * from t1;
+-------+------+
| id    | b    |
+-------+------+
|     1 |    1 |
| 30001 |    1 |
+-------+------+
2 rows in set (0.00 sec)
```

- and then check back to first tidb-server:

```
mysql> update t1 set b = 2 where id = 30001;
Query OK, 1 row affected (0.04 sec)

mysql> select * from t1;
+-------+------+
| id    | b    |
+-------+------+
|     1 |    1 |
| 30001 |    2 |
+-------+------+
2 rows in set (0.01 sec)

mysql> insert into t1(b) values(3);
Query OK, 1 row affected (0.01 sec)

mysql> select * from t1;
+-------+------+
| id    | b    |
+-------+------+
|     1 |    1 |
| 30001 |    2 |
| 60001 |    3 |
+-------+------+
3 rows in set (0.00 sec)
```


2. What did you expect to see?
Expected id of `insert into t1(b) values(3)` is `2`.


3. What did you see instead?
id of `insert into t1(b) values(3)` is `60001`.
It seems that when check back to first tidb-server, do update to row of id `30001`, tidb rebased it autoid, and next insert id increasing dramatically.
I don't know it's expected, so issued here.

4. What version of TiDB are you using (`tidb-server -V` or run `select tidb_version();` on TiDB)?
v2.0.6, commit: b13bc08462a584a085f377625a7bab0cc0351570